{
  "kind": "models.search.v3",
  "schemaVersion": 3,
  "generatedAtUtc": "2026-01-10T00:00:00Z",
  "resource": "models.search",
  "filtersApplied": {},
  "rejectedFilters": {},
  "data": {
    "pageNumber": 1,
    "pageSize": 50,
    "totalCount": null,
    "summary": null,
    "displayTables": [],
    "engineDatasets": []
  },
  "warnings": []
}